{
    "version": "1",
    "generated_at": "2025-11-21T07:39:09.529348+00:00Z",
    "models": [
        {
            "name": "arp",
            "description": "Standard TCP Model",
            "repo_url": "https://github.com/znetlink/ms-models-arp",
            "author": "ZNetLink",
            "latest_version": "0.3.0",
            "last_updated": "2025-11-13",
            "labels": [
                "ARP",
                "TCP/IP"
            ]
        },
        {
            "name": "example",
            "description": "一些基础的示例模型，测试模型安装效果",
            "repo_url": "https://github.com/znetlink/ms-models-example",
            "author": "ZNetLink",
            "latest_version": "0.1.1",
            "last_updated": "2025-11-14",
            "labels": [
                "example"
            ]
        },
        {
            "name": "generic_wireless",
            "description": "通用无线MAC层模型，在不关心MAC层具体实现的情况下，可以使用此模型进行模拟MAC层提供的通信能力。",
            "repo_url": "https://github.com/znetlink/ms-model-generic-wireless",
            "author": "ZNetLink",
            "latest_version": "0.1.4",
            "last_updated": "2025-11-21",
            "labels": [
                "MAC"
            ]
        },
        {
            "name": "udp",
            "description": "Standard UDP Model",
            "repo_url": "https://github.com/znetlink/ms-models-udp",
            "author": "ZNetLink",
            "latest_version": "1.0.0",
            "last_updated": "2024-06-01",
            "labels": [
                "UDP",
                "TCP/IP"
            ]
        }
    ],
    "packages": [
        {
            "name": "basic",
            "description": "Basic models for testing purposes",
            "repo_url": "https://github.com/znetlink/ms-packages-basic",
            "author": "ZNetLink",
            "last_updated": "2024-06-01",
            "labels": [
                "testing",
                "basic"
            ]
        }
    ]
}